{
  "version": 1,
  "slug": "tamron-28-200mm-f28-56-di-iii-rxd",
  "name": "Tamron 28-200mm F/2.8-5.6 Di III RXD",
  "make": "Tamron",
  "model": "28-200mm F/2.8-5.6 Di III RXD",
  "description": "Versatile full-frame zoom for travel and everyday shooting.",
  "image": "meta/lenses/tamron-28-200mm-f28-56-di-iii-rxd.png"
}
